NOVEDADES CHETUMAL,CCPRI/3/TC/15/20507,Diario,Novedades Chetumal,"Novedades de Quintana Roo, S.A. de C.V.",NQR811130HN1,Quintana Roo,2,77010,Chetumal,Adolfo López Mateos,Carretera a Calderitas km 2,983.832.2285 ,Gerardo Gabriel Garcia Gamboa,Claudia Martín Alarcón,Laura Eugenia Ortiz Espinoza,22 NOV 1974,20 JUN 2019, www.sipse.com,publicidad@novenet.com.mx,Marco Lozano Ocman,Marco Antonio Briceño Narváez,José Manuel Cárdenas Chávez,SI,SI,SI,SI,Periódico,NOVEDADES CHETUMAL,CCPRI/3/TC/15/20507,Diario,12 JUL 2019,24 JUN 2019,5873,Certificadora,Agencia Certificadora y Gestora de Medios SC,90,5758,523980,10350,513630,5707,NOVEDADES CHETUMAL,CCPRI/3/TC/15/20507,Diario,"Agencia Certificadora y Gestora de Medios, S.C.",Ciudad De México,49,1402-14,6500,Cuauhtemoc,Cuauhtémoc,Río Mississipi,55.3685.2022,www.agenciacgm.com,Cuestionario,5758,310,97,26 JUN 2019,03 JUL 2019,Internet,Más Menos Tres,44%,56%,100%,26%,36%,,29%,41%,24%,23%,44%,34%,22%,,,,8%,,,,,,,MORAL,acgm.sc@gmail.com,9%,,12%,7%,12%,,,,30%,4590,4590,51,,,,,,,,,,,30%,A,,,,,,,,,,,,,,,,9%,,4%,,,,,,,,,,,,,,,,,,,,,,,,,,,,,,,,,,,,,,,,,,,,,,,,,,,,,,,,,,,,,,,,,,,,,,,,,,,,,,,,,,,,,,,,,,,,,,,,,,,,,,,,,,,,,,,,,,,,,
NOVEDADES QUINTANA ROO,CCPRI/3/TC/18/21025,Diario,Novedades Quintana Roo,"NOVEDADES DE QUINTANA ROO, S.A. DE C.V.",NQR811130HN1,Quintana Roo,37,77500,Benito Juarez,Retorno 2,Pecari,998.881.5929 ,Gerardo García Gamboa,Claudia Martín,Laura Ortiz Espinoza,22 NOV 1974,09 MAR 2022, www.sipse.com,publicidad@novenet.com.mx,Gerardo García Gamboa,Marco Antonio Briceño Narvaez,Carmen Burgara Santiago,NO,SI,SI,SI,Periódico,NOVEDADES QUINTANA ROO,CCPRI/3/TC/18/21025,Diario,25 MAR 2020,03 MAR 2022,35500,Certificadora,Agencia Certificadora y Gestora de Medios SC,88,35050,3130600,46200,3084400,35050,NOVEDADES QUINTANA ROO,CCPRI/3/TC/18/21025,Diario,"Agencia Certificadora y Gestora de Medios, S.C.",Ciudad De México,49,1402-14,6500,Cuauhtemoc,Cuauhtémoc,Río Mississipi,55.3685.2022,www.agenciacgm.com,Encuesta,35050,308,97,24 FEB 2022,03 MAR 2022,Internet,Más Menos Tres,44%,56%,100%,18%,31%,36%,15%,45%,28%,21%,39%,49%,12%,,,,8%,9%,,,,,,MORAL,acgm.sc@gmail.com,,,6%,12%,23%,,,,26%,,,,,,,,,,,,,,14%,SM 20 M6,,,,,,,,,,,,,,,,8%,,,,,,,,,,,,,,,,,,,,,,,,,,,,,,,,,,,,,,,,,,,,,,,,,,,,,,,,,,,,,,,,,,,,,,,,,,,,,,,,,,,,,,,,,,,,,,,,,,,,,,,,,,,,,,,,,,,,,,,
PERIÓDICO ESPACIO DE QUINTANA ROO,CCPRI/3/TC/16/20663,Quincenal,Periódico Espacio De Quintana Roo,Fabomu Publicidad S.A. de C.V.,FPU140610D83,Quintana Roo,1,77509,Benito Juarez,SM 24,Av. Tankah,998.884.5379 ,,Jennifer Martínez Guzmán,,18 JUN 2014,, www.periodicoespacio.com,administracion@periodico.com,Saira Muñoz Gámez,Saira Muñoz Gámez,,NO,NO,SI,SI,Periódico,PERIÓDICO ESPACIO DE QUINTANA ROO,CCPRI/3/TC/16/20663,Quincenal,11 NOV 2021,20 SEP 2021,50000,Certificadora,"Brumat Media, S.A. de C.V.",6,50000,,,,,PERIÓDICO ESPACIO DE QUINTANA ROO,CCPRI/3/TC/16/20663,Quincenal,"Brumat Media, S.A. de C.V.",,,,,,,,,,Encuesta,50000,382,95,01 SEP 2021,20 SEP 2021,Internet,Más Menos Cinco,52%,48%,100%,8%,23%,30%,39%,100%,,,52%,48%,,,,,,,,,,,,,,,,,,,,,,52%,300000,300000,50000,,,,,,,,,,,48%,,,,,,,,,,,,,,,,,,,,,,,,,,,,,,,,,,,,,,,,,,,,,,,,,,,,,,,,,,,,,,,,,,,,,,,,,,,,,,,,,,,,,,,,,,,,,,,,,,,,,,,,,,,,,,,,,,,,,,,,,,,,,,,,,,,,,,,,
PERIODISMO VERDAD LUCES DEL SIGLO,CCPRI/3/TC/16/20625,Diario,Periodismo Verdad Luces Del Siglo,Norma Madero Jiménez,MAJN680820J35,Quintana Roo,1,77520,Benito Juarez,Fracc. Bahía Azul,Calle 1,998.207.7105 ,Norma Madero Jiménez,Agustín Ambriz,Sergio Guzmán,11 ENE 2016,, www.lucesdelsiglo.com,publicidad@lucesdelsiglo.com,Diana Laura Paredes Madero,Norma Madero Jiménez,Delia Adriana Madero Jiménez,NO,SI,SI,SI,Periódico,PERIODISMO VERDAD LUCES DEL SIGLO,CCPRI/3/TC/16/20625,Diario,17 MAR 2021,16 FEB 2021,13461,Certificadora,"Jimsa Comunicación, Activación de Marcas, S.A. de C.V.",65,12261.54,867200,78000,789200,12141.54,PERIODISMO VERDAD LUCES DEL SIGLO,CCPRI/3/TC/16/20625,Diario,"Jimsa Comunicación, Activación de Marcas, S.A. de C.V.",Ciudad De México,58,1,6720,Cuauhtemoc,Doctores,Dr. Jiménez,55448561,,Encuesta,500,150,96,05 ENE 2021,11 FEB 2021,,Más Menos Cuatro,90%,10%,97%,,21%,30%,28%,41%,49%,,27%,3%,70%,,,,,,,,,,,MORAL,jimsacomunicacion@hotmail.com,10%,,10%,,,,,,,7800,7800,120,,,,,,,,,3%,,,Mz. 62 Sm.84,,,,,,,,,,,,11%,,,,,,,,,,,,,,,,,,,,,,,,,,,,,,,,,,,,,,,,,,,,,,,,,,,,,,,,,,,,,,,,,,,,,,,,,,,,,,,,,,,,,,,,,,,,,,,,,,,65%,21%,3%,,,,,,,,,,,,,,,,,,,,,,
"POR ESTO! QUINTANA ROO DIGNIDAD, IDENTIDAD Y SOBERANÍA",CCPRI/3/TC/18/21008,Diario,"Por Esto! Quintana Roo Dignidad, Identidad Y Soberanía","Compañía Editora del Mayab, S.A. de C.V.",EMA99042272A,Quintana Roo,98,77537,Cancún,Región 98,Av. Andrés Quintana Roo,999.930.2760 ,,Alicia Menéndez Figueroa,Omar Sánchez,21 MAR 1991,, www.poresto.net,aliciamenendez@poresto.mx,Alicia Menéndez Figueroa,Alicia Menéndez Figueroa,Alicia Menéndez Figueroa,NO,NO,SI,SI,Periódico,"POR ESTO! QUINTANA ROO DIGNIDAD, IDENTIDAD Y SOBERANÍA",CCPRI/3/TC/18/21008,Diario,07 MAR 2022,02 FEB 2022,34236,Certificadora,Agencia Certificadora y Gestora de Medios SC,90,32700,3081240,138240,2943000,32700,"POR ESTO! QUINTANA ROO DIGNIDAD, IDENTIDAD Y SOBERANÍA",CCPRI/3/TC/18/21008,Diario,Agencia Certificadora y Gestora de Medios SC,Ciudad De México,49,1402 14,6500,Cuauhtemoc,Cuauhtémoc,Río Mississipi,5536852022,www.agenciacgm.com,Cuestionario,32700,315,97,24 ENE 2022,02 FEB 2022,Internet,Más Menos Tres,36%,64%,93%,9%,32%,28%,24%,93%,7%,,36%,32%,32%,,,,,,,,,,,MORAL,acgm.sc@gmail.com,7%,,,,10%,,,,29%,,,,,,,,,,,,7%,,61%,63,,,,,,,,,,,,,,,,,,,,,,,,,,,,,,,,,,,,,,,,,,,,,,,,,,,,,,,,,,,,,,,,,,,,,,,,,,,,,,,,,,,,,,,,,,,,,,,,,,,,,,,,,,,,,,,,,,,,,,,,,,,,,,,,,,,,,,,
QUEQUI,CCPRI/3/TC/09/18476,Diario,Quequi,"GRUPO INFORMÁTICO CANCÚN CARIBE, S.A. DE C.V.",OEC040920CL3,Quintana Roo,70,77510,Benito Juarez,Cancún,Francisco I Madero,019981932100 ,,Rafael Santiago Campos,Rafael Santiago Campos,07 JUN 2000,, www.diarioque.com.mx,jgomez@diarioque.com.mx,,José Alberto Gómez Álvarez,Nadia Labastida Negrete,NO,NO,SI,,Periódico,QUEQUI,CCPRI/3/TC/09/18476,Diario,05 MAR 2021,08 FEB 2021,20000,Certificadora,"Romay Hermida y Cía, S. C.",90,19098.62,1031616,53937,1358876,15098.62,QUEQUI,CCPRI/3/TC/09/18476,Diario,"Romay Hermida y Cía, S. C.",Puebla,73,,72810,San Andres Cholula,Paseos de Cholula,Paseo de Cholula,012222218809,,Encuesta,4000,500,95,01 DIC 2020,31 DIC 2020,Calle,Más Menos Cinco,48%,52%,100%,,30%,33%,25%,80%,20%,,65%,25%,10%,,,,13%,,,,,José Alberto Gómez Álvarez,SI,MORAL,romayhermidayciasc@gmail.com,12%,,,,12%,,,,,360000,360000,4000,5%,10%,,381197,,23%,11%,26%,,,,Mza 5,,,,,,,,,,,,,,,,,,,,,,,,,,,,,,,,,,,,,,,,,,,,,,,,,,,,,,,,,,,,,,,,,,,,,,,,,,,,,,,,,,,,,,,,,,,,,,,,,,,,,,,,,,,,,,,,,,,,,,,,,,,,,,,,,,,,,,,
QUINTANA ROO HOY,CCPRI/3/TC/16/20583,Lunes A Sábado,Quintana Roo Hoy,"Publicaciones Zafiro, S.A de C.V.",PZA090908ES4,Quintana Roo,21,77536,Benito Juarez,Región 518,Ing. Mario Villanueva Madrid,998.802.1812 ,Miguel Ángel Cantón Zetina,Marco Antonio García Granado,Licetty Díaz Wong,01 SEP 2015,19 OCT 2019, www.quintanaroohoy.com,grupocanton@outlook.com,Miguel Ángel Cantón Zetina,Aurora Olin Godoy,Martha Mota Gevara,SI,NO,SI,SI,Periódico,QUINTANA ROO HOY,CCPRI/3/TC/16/20583,Lunes A Sábado,13 DIC 2019,08 DIC 2019,39000,Certificadora,"Asociación Interactiva Para el Desarrollo Productivo, A. C.",90,39000,3304800,64800,3240000,36000,QUINTANA ROO HOY,CCPRI/3/TC/16/20583,Lunes A Sábado,Asociación Interactiva para el Desarrollo Productivo A.C.,México,4,Lt. 8,,Ecatepec,Quinto Sol,Avenida Ensueño,,http://www.aindep.org/,Cuestionario,1203,500,95,01 SEP 2019,19 OCT 2019,Internet,Más Menos Cinco,48%,52%,85%,19%,20%,23%,30%,38%,30%,22%,52%,10%,28%,3%,6%,,,,,,,,,MORAL,informacion@aindep.org.mx,5%,,10%,,22%,,,,,270000,270000,3000,,,,,,,,,15%,3%,,Lt. 1,,,,,,,,,,,,,,,,,55%,5%,1%,,18%,,,,,,,,,,,,,,,,,,,,,,,,,,,,,,,,,,,,,,,,,,,,,,,,,,,,,,,,,,,,,,,,,,,,,,,,,,,,,,,,,,,,,,,,,,,,,,,,,,,,,,,,,,,,,,,,,,
24 HORAS EL DIARIO SIN LÍMITES QUINTANA ROO,CCPRI/3/TC/18/21127,Lunes A Viernes,24 Horas El Diario Sin Límites Quintana Roo,"24 Alternativa en Publicidad, S.A. de C.V.",VAP180705R33,Quintana Roo,3,77505,Benito Juarez,SUPERMANZANA 15 A,Av. Tulum,998.688.9530 ,,Ricardo Gabriel Méndez Huicab,Ricardo Gabriel Méndez Huicab,05 JUL 2018,25 ENE 2022, www.24horasqroo.mx,juridico@24horasqroo.mx,Fernando Morales Martínez,Héctor Ledesma Durán,,SI,NO,SI,SI,Periódico,24 HORAS EL DIARIO SIN LÍMITES QUINTANA ROO,CCPRI/3/TC/18/21127,Lunes A Viernes,10 MAR 2022,14 FEB 2022,25700,Certificadora,"Brumat Media, S.A. de C.V.",78,25500,,,,,24 HORAS EL DIARIO SIN LÍMITES QUINTANA ROO,CCPRI/3/TC/18/21127,Lunes A Viernes,"Brumat Media, S.A. de C.V.",,,,,,,,,,Encuesta,25500,379,95,07 FEB 2022,11 FEB 2022,Internet,Más Menos Cinco,44%,56%,95%,18%,27%,34%,21%,40%,33%,20%,49%,30%,14%,,7%,,8%,,,,,,,,,,,7%,,12%,8%,,,33%,1443000,1443000,18500,,,,,,,,,5%,,20%, Lote 2-01 L.002,,,,,,,507000,507000,6500,,,,,,,12%,,7%,,,,,,,,39000,39000,500,,,,,,,,,,,,,,,,,,,,,,,,,,,,,,,,,,,,,,,,,,,,,,,,,,,,,,,,,,,,,,,,,,,,,,,,,,,,,,,,,,,,,,,,,,,,,,,,,,,,,,,,,,,
24 HORAS EL DIARIO SIN LÍMITES YUCATÁN,CCPRI/3/TC/22/21364,Lunes A Viernes,24 Horas El Diario Sin Límites Yucatán,Integración de Medios de la Peninsula S.A. de C.V.,IMP210705KUA,Quintana Roo,3,77505,Benito Juarez,Supermanzana 15 A,Av. Tulúm Manzana,,,Ricardo Gabriel Mendez Huicab,,05 JUL 2021,18 FEB 2022, www.24horasyucatan.mx,juridico@24horasqroo.mx,Fernando Morales Martínez,Hector Ledesma Duran,,SI,NO,SI,SI,Periódico,24 HORAS EL DIARIO SIN LÍMITES YUCATÁN,CCPRI/3/TC/22/21364,Lunes A Viernes,02 MAY 2022,08 ABR 2022,25000,Certificadora,"Brumat Media, S.A. de C.V.",64,24750,,,,,24 HORAS EL DIARIO SIN LÍMITES YUCATÁN,CCPRI/3/TC/22/21364,Lunes A Viernes,"Brumat Media, S.A. de C.V.",,,,,,,,,,Encuesta,24750,379,95,01 MAR 2022,07 MAR 2022,Internet,Más Menos Cinco,39%,61%,93%,13%,26%,33%,28%,63%,23%,8%,48%,25%,21%,,6%,,6%,,,,,,,,,,,6%,,12%,7%,,,32%,1216000,1216000,19000,,,,,,,,,7%,,23%,Lote 2-01 Local 002,,,,,,,368000,368000,5750,,,,,,,16%,,4%,,,,,,,,,,,,,,,,,,,,,,,,,,,,,,,,,,,,,,,,,,,,,,,,,,,,,,,,,,,,,,,,,,,,,,,,,,,,,,,,,,,,,,,,,,,,,,,,,,,,,,,,,,,,,,,,,,,,,
EL SOL DE SAN LUIS,CCPRI/3/TC/08/18079,Diario,El Sol De San Luis,"Cía. Periodística del Sol de San Luis Potosí, S.A. de C.V.",CPS7907244H2,San Luis Potosí,565,78000,San Luis Potosi,Centro,Universidad,444.8124.412 ,Paquita Ramos de Vázquez,Ricardo Ortega Canveros,Rafael Ruíz Rangel,04 DIC 1952,10 OCT 2018, www.oem.com.mx,dirslp@oem.com.mx,Paquita Ramos de Vázquez,Carlos Salvador Huerta Lara,Marcela García Torres,SI,NO,SI,SI,Periódico,EL SOL DE SAN LUIS,CCPRI/3/TC/08/18079,Diario,12 MAR 2019,07 MAR 2019,36416,Certificadora,Agencia Certificadora y Gestora de Medios SC,88,36416,3204608,,3204608,36416,EL SOL DE SAN LUIS,CCPRI/3/TC/08/18079,Diario,Agencia Certificadora y Gestora de Medios SC,Ciudad De México,49,1402 14,6500,Cuauhtemoc,Cuauhtémoc,Río Mississipi,5536852022,www.agenciacgm.com,Cuestionario,36416,2495,95,28 FEB 2019,07 MAR 2019,Internet,Más Menos Cinco,47%,53%,100%,6%,25%,39%,23%,30%,18%,33%,48%,7%,34%,,11%,20%,6%,,,,,,,MORAL,acgm.sc@gmail.com,7%,,19%,21%,19%,,,,32%,,,,,,,,,,,,,,,,,,,,,,,,,,,,,,,,,,,,,,,,,,,,,,2%,,,,,,,,,,,,,,,,,,,,,,,,,,,,,,,,,,,,,,,,,,,,,,,,,,,,,,,,,,,,,,,,,,,,,,,,,,,,,,,,,,,,,,,,,,,,,,,,,,,,,,,,
PLANO INFORMATIVO,CCPRI/3/TC/16/20571,Diario,Plano Informativo,"Diario Net, S. A. de C. V.",DNE151026NP2,San Luis Potosí,120,78200,San Luis Potosi,Del Valle,Julián Carrillo,444 833.6919 ,Carmenchu Torres Vilet,Francisco Javier Rosales Hernández,Ana Luisa Marun Rodríguez,26 OCT 2015,, www.planinformativo.com,contabilidad@planoinformativo.com,Francisco Javier Rosales Hernández,Francisco Javier Rosales Hernández,Christian Navarro Becerril,NO,SI,SI,SI,Periódico,PLANO INFORMATIVO,CCPRI/3/TC/16/20571,Diario,17 FEB 2021,08 FEB 2021,15270,Certificadora,Agencia Certificadora y Gestora de Medios SC,92,15000,1404840,24840,1380000,15000,PLANO INFORMATIVO,CCPRI/3/TC/16/20571,Diario,Agencia Certificadora y Gestora de Medios SC,Ciudad De México,49,1402 14,6500,Cuauhtemoc,Cuauhtémoc,Río Mississipi,5536852022,www.agenciacgm.com,Cuestionario,15000,315,95,02 FEB 2021,09 FEB 2021,,Más Menos Cinco,46%,54%,,17%,13%,33%,21%,92%,8%,,67%,17%,16%,,,,,10%,,,,Francisco Javier Rosales Hernández,SI,MORAL,acgm.sc@gmail.com,8%,8%,,8%,31%,,,,29%,,,,,,,,,,,,100%,,12%,A,SI,,,,,,,,,,,,,4%,,6%,,,,,,,,,,,,,,,,,,,,,,,,,,,,,,,,,,,,,,,,,,,,,,,,,,,,,,,,,,,,,,,,,,,,,,,,,,,,,,,,,,,,,,,,,,,,,,,,,,,,,,,,,,,,,,,,,,,,,,,
CULIACAN LA I NOTICIAS PARA MI,CCPRI/3/TC/13/19978,Diario,Culiacan La I Noticias Para Mi," Empresas El Debate, S.A de C.V.",EDE000301QT5,Sinaloa,555,80000,Culiacán,Centro,Blvd. Francisco I. Madero,667 759.0900 ,Luis Javier Salido Artola,María Andrea Miranda Ramos,Gustavo Lizarraga Reyes,24 OCT 1972,22 MAR 2022, www.debate.com.mx,mary.avendano@debate.com.mx,Shamalak Edison Ibarra Valdez,Shamalak Edison Ibarra Valdez,María de los Ángeles Avendaño Gálvez,SI,NO,SI,SI,Periódico,CULIACAN LA I NOTICIAS PARA MI,CCPRI/3/TC/13/19978,Diario,02 MAY 2022,14 MAR 2022,31005,Certificadora,Agencia Certificadora y Gestora de Medios SC,88,30249,1929928,66528,2661912,30249,CULIACAN LA I NOTICIAS PARA MI,CCPRI/3/TC/13/19978,Diario,"Agencia Certificadora y Gestora de Medios, S.C.",Ciudad De México,49,1402-14,6500,Cuauhtemoc,Cuauhtémoc,Río Mississipi,55.3685.2022,www.agenciacgm.com,Cuestionario,30249,373,96,07 MAR 2022,14 MAR 2022,Internet,Más Menos Cuatro,47%,53%,86%,33%,19%,13%,10%,25%,41%,34%,22%,6%,38%,10%,24%,,15%,4%,,,,,,MORAL,acgm.sc@gmail.com,8%,6%,,17%,17%,27%,,,11%,,,,,,,798512,,,,,14%,11%,9%,,,,,,,,,,,,,,,,,,,,,,,,,,,,,,,,,,,,,,,,,,,,,,,,,,,,,,,,,,,,,,,,,,,,,,,,,,,,,,,,,,,,,,,,,,,,,,,,,,,,,,,,,,,,,,,,,,,,,,,,,,,,,,,,,,,,,,,,
EL DEBATE DE CULIACÁN,1/432-80-01539,Diario,El Debate De Culiacán,"Empresas El Debate, S.A de C.V",EDE000301qt5,Sinaloa,555,80000,Culiacán,Centro,Blvd. Francisco I. Madero,667 759.0900 ,Luis Javier Salido Artola,María Andrea Miranda Ramos,Gustavo Lizarraga Reyes,24 OCT 1972,15 FEB 2022, www.debate.com.mx,mary.avendano@debate.com.mx,,Shamalk Edison Ibarra Valdez,María de los Ángeles Avendaño Gálvez,SI,NO,SI,SI,Periódico,EL DEBATE DE CULIACÁN,1/432-80-01539,Diario,02 MAY 2022,17 MAR 2022,72509,Certificadora,Agencia Certificadora y Gestora de Medios SC,88,70741,4513256,155584,6225208,70741,EL DEBATE DE CULIACÁN,1/432-80-01539,Diario,"Agencia Certificadora y Gestora de Medios, S.C.",Ciudad De México,49,1402-14,6500,Cuauhtemoc,Cuauhtémoc,Río Mississipi,55.3685.2022,www.agenciacgm.com,Encuesta,70741,735,96,10 MAR 2022,17 MAR 2022,Internet,Más Menos Cuatro,43%,57%,96%,33%,29%,18%,12%,50%,50%,,50%,6%,18%,11%,13%,,9%,4%,,,,Shemalak Edison Ibarra Valdez,,MORAL,acgm.sc@gmail.com,5%,,,10%,8%,16%,,,21%,,,,,,,1867536,,,,,4%,3%,32%,,,,,,,,,,,,,,,,,,,,2%,,,,,,,,,,,,,,,,,,,,,,,,,,,,,,,,,,,,,,,,,,,,,,,,,,,,,,,,,,,,,,,,,,,,,,,,,,,,,,,,,,,,,,,,,,,,,,,,,,,,,,,,,,,,,,,,,,,,
EL DEBATE DE GUASAVE,1/432-87-05046,Diario,El Debate De Guasave,"El Debate, S.A de C.V",DEB800830RU6,Sinaloa,52,81000,Guasave,Centro,Cuauhtémoc,687.827.3200 ,Idelfonso Salido Ibarra,Andrea Miranda,Edgar Vega,24 OCT 1984,22 MAR 2022, www.debate.com.mx,debate@debate.com.mx,Shamalak Edison Ibarra Valdéz,Anabel de la Rocha,María de los Ángeles Avendaño,SI,SI,SI,SI,Periódico,EL DEBATE DE GUASAVE,1/432-87-05046,Diario,02 MAY 2022,17 MAR 2022,10043,Certificadora,Agencia Certificadora y Gestora de Medios SC,88,9871,623216,15136,868648,9871,EL DEBATE DE GUASAVE,1/432-87-05046,Diario,"Agencia Certificadora y Gestora de Medios, S.C.",Ciudad De México,49,1402-14,6500,Cuauhtemoc,Cuauhtémoc,Río Mississipi,55.3685.2022,www.agenciacgm.com,Encuesta,9871,361,96,11 MAR 2022,18 MAR 2022,Internet,Más Menos Cuatro,45%,55%,91%,29%,25%,21%,11%,73%,,27%,37%,2%,40%,5%,16%,,11%,2%,,,,,,MORAL,acgm.sc@gmail.com,3%,,,9%,10%,18%,,,19%,,,,,,,260568,,,,,9%,11%,31%,Ote,,,,,,,,,,,,,,,,,,,,,,,,,,,,,,,,,,,,,,,,,,,,,,,,,,,,,,,,,,,,,,,,,,,,,,,,,,,,,,,,,,,,,,,,,,,,,,,,,,,,,,,,,,,,,,,,,,,,,,,,,,,,,,,,,,,,,,,
EL DEBATE DE LOS MOCHIS,1/432-87-05047,Diario,El Debate De Los Mochis,"El Debate, S.A de C.V",DEB800830RU6,Sinaloa,55,81200,Los Mochis,Primer Cuadro Centro,Av. Alvaro Obregón Ote.,668 816 04 00 ,Luis Javier Salido Artola,Maria Andrea Miranda Ramos,Cristina Muñoz Grageda,10 MAR 1941,22 MAR 2022, www.debate.com.mx,,Shamalak Edison Ibarra Váldez,Anabel de la Rocha Ruelas,Lucero Ramírez Serna,SI,NO,SI,SI,Periódico,EL DEBATE DE LOS MOCHIS,1/432-87-05047,Diario,02 MAY 2022,18 MAR 2022,19606,Certificadora,Agencia Certificadora y Gestora de Medios SC,88,19269,1216688,29656,1695672,19269,EL DEBATE DE LOS MOCHIS,1/432-87-05047,Diario,"Agencia Certificadora y Gestora de Medios, S.C.",Ciudad De México,49,1402-14,6500,Cuauhtemoc,Cuauhtémoc,Río Mississipi,55.3685.2022,www.agenciacgm.com,Cuestionario,19269,426,95,11 MAR 2022,18 MAR 2022,Internet,Más Menos Cinco,48%,52%,95%,19%,30%,26%,21%,64%,,24%,44%,6%,31%,5%,14%,,10%,4%,,,,Edison Ibarra,,MORAL,acgm.sc@gmail.com,4%,,12%,10%,20%,14%,,,26%,,,,,,,508640,,,,,5%,,16%,Ote,,,,,,,,,,,,,,,,,,,,,,,,,,,,,,,,,,,,,,,,,,,,,,,,,,,,,,,,,,,,,,,,,,,,,,,,,,,,,,,,,,,,,,,,,,,,,,,,,,,,,,,,,,,,,,,,,,,,,,,,,,,,,,,,,,,,,,,
EL DEBATE DE MAZATLAN,1/432-00-15306,Diario,El Debate De Mazatlan,"Empresas El Debate, S.A de C.V",EDE000301QT5,Sinaloa,1,82157,Mazatlán,Costa Brava,Avenida Circunvalación,669.989.0900 ,Luis Javier Salido Artola,María Andrea Miranda Ramos,Jesús Orlando Samaniego Meza,15 FEB 2022,22 MAR 2022, www.debate.com.mx,mary.avendano@debate.com.mx,Shamalak Edison Ibarra Valdéz,Shamalak Edison Ibarra Valdez,Abigail Ramírez Valdez,SI,NO,SI,SI,Periódico,EL DEBATE DE MAZATLAN,1/432-00-15306,Diario,02 MAY 2022,18 MAR 2022,6395,Certificadora,Agencia Certificadora y Gestora de Medios SC,88,6285,396880,9680,553080,6285,EL DEBATE DE MAZATLAN,1/432-00-15306,Diario,"Agencia Certificadora y Gestora de Medios, S.C.",Ciudad De México,49,1402-14,6500,Cuauhtemoc,Cuauhtémoc,Río Mississipi,55.3685.2022,www.agenciacgm.com,Entrevista,6285,296,96,11 MAR 2022,18 MAR 2022,Internet,Más Menos Cuatro,39%,61%,98%,19%,33%,26%,16%,65%,,24%,40%,6%,32%,6%,16%,,11%,2%,,,,,,MORAL,acgm.sc@gmail.com,6%,,11%,16%,14%,20%,,,24%,,,,,,,165880,,,,,2%,,13%,,,,,,,,,,,,,,,,,,,,,,,,,,,,,,,,,,,,,,,,,,,,,,,,,,,,,,,,,,,,,,,,,,,,,,,,,,,,,,,,,,,,,,,,,,,,,,,,,,,,,,,,,,,,,,,,,,,,,,,,,,,,,,,,,,,,,,,,
EL DEBATE GUAMUCHIL,1/432-87-05048,Diario,El Debate Guamuchil,"Empresas El Debate, S.A de C.V.",EDE000301QT5,Sinaloa,555,81490,Salvador Alvarado,Centro,Silverio Trueba y 22 de Dic.,673.732.5150 ,Luis Javier Salido Artola,María Andrea Miranda Ramos,Vianey Contreras,,15 FEB 2022, www.debate.com.mx,mary.avendano@debate.com.mx,Shamalak Edison Ibarra Valdez,Shamalak Edison Ibarra Valdez,Oralia Rendon Gaxiola,SI,NO,SI,SI,Periódico,EL DEBATE GUAMUCHIL,1/432-87-05048,Diario,02 MAY 2022,17 MAR 2022,3883,Certificadora,Agencia Certificadora y Gestora de Medios SC,88,3816,241032,5896,335808,3816,EL DEBATE GUAMUCHIL,1/432-87-05048,Diario,"Agencia Certificadora y Gestora de Medios, S.C.",Ciudad De México,49,1402-14,6500,Cuauhtemoc,Cuauhtémoc,Río Mississipi,55.3685.2022,www.agenciacgm.com,Encuesta,3816,203,97,10 MAR 2022,17 MAR 2022,Internet,Más Menos Tres,48%,52%,93%,16%,29%,21%,24%,35%,28%,27%,38%,13%,33%,4%,12%,,9%,4%,,,,,,MORAL,acgm.sc@gmail.com,7%,3%,10%,10%,8%,16%,,,21%,,,,,,,100672,,,,,7%,,32%,,,,,,,,,,,,,,,,,,,,,,,,,,,,,,,,,,,,,,,,,,,,,,,,,,,,,,,,,,,,,,,,,,,,,,,,,,,,,,,,,,,,,,,,,,,,,,,,,,,,,,,,,,,,,,,,,,,,,,,,,,,,,,,,,,,,,,,,
EL SOL DE MAZATLAN,CCPRI/3/TC/09/18291,Diario,El Sol De Mazatlan,"Cía. Periodística El Sol de Mazatlán, S. A. de C. V.",PSM040701E94,Sinaloa,312,82040,Mazatlán,Playa Sur,Av. Miguel Alemán,01.669.915.5600 ,Paquita Ramos de Vázquez,Juan Veledíaz Alvares,Juan Carlos Cruz García,17 DIC 2004,30 SEP 2018, www.oem.com.mx,dirmaz@oem.com.mx,Paquita Ramos de Vázquez,Carlos Salvador Huerta Lara,Selene Bojorges Valenzuela,SI,NO,SI,SI,Periódico,EL SOL DE MAZATLAN,CCPRI/3/TC/09/18291,Diario,12 MAR 2019,07 MAR 2019,7229,Certificadora,"Agencia Certificadora y Gestora de Medios, S.C.",88,7229,636152,,636152,7229,EL SOL DE MAZATLAN,CCPRI/3/TC/09/18291,Diario,"Agencia Certificadora y Gestora de Medios, S.C.",Ciudad De México,49,1402-14,6500,Cuauhtemoc,Cuauhtémoc,Río Mississipi,55.3685.2022,http://www.agenciacgm.com,Cuestionario,7229,523,97,28 FEB 2019,07 MAR 2019,,Más Menos Tres,47%,53%,100%,6%,25%,39%,23%,30%,18%,33%,45%,5%,34%,,16%,11%,8%,,,,,Paquita Ramos de Vázquez,,MORAL,acgm.sc@gmail.com,7%,,19%,32%,21%,,,,28%,,,,,,,,,,,,,,,,,,,,,,,,,,,,,,,,,,,,,,,,,,,,,,,,,,,,,,,,,,,,,,,,,,,,,,,,,,,,,,,,,,,,,,,,,,,,,,,,,,,,,,,,,,,,,,,,,,,,,,,,,,,,,,,,,,,,,,,,,,,,,,,,,,,,,,
EL SOL DE SINALOA,CCPRI/3/TC/08/18058,Diario,El Sol De Sinaloa,"Cía. Periodística del Sol de Culiacán, S.A. de C.V.",CPS100601Q78,Sinaloa,320,80000,Culiacán,Centro,Blvd. Gabriel Leyva Solano,667.713.1597 ,Paquita Ramos de Vázquez,Juan Velediaz Álvarez,Alma Angelina Soto Galván,01 DIC 1956,10 OCT 2018, www.oem.com.mx,dircul@oem.com.mx,Paquita Ramos de Vázquez,Carlos Salvador Huerta Lara,Selene Bojorges Valenzuela,SI,NO,SI,SI,Periódico,EL SOL DE SINALOA,CCPRI/3/TC/08/18058,Diario,12 MAR 2019,07 MAR 2019,12480,Certificadora,"Agencia Certificadora y Gestora de Medios, S.C.",88,12480,1098240,,1098240,12480,EL SOL DE SINALOA,CCPRI/3/TC/08/18058,Diario,"Agencia Certificadora y Gestora de Medios, S.C.",Ciudad De México,49,1402-14,6500,Cuauhtemoc,Cuauhtémoc,Río Mississipi,55.3685.2022,http://www.agenciacgm.com,Encuesta,12480,1478,96,28 FEB 2019,07 MAR 2019,Internet,Más Menos Cuatro,47%,53%,100%,6%,25%,39%,23%,30%,18%,33%,38%,7%,35%,,20%,20%,7%,,,,,Paquita Ramos de Vázquez,SI,MORAL,acgm.sc@gmail.com,7%,,19%,34%,17%,,,,19%,,,,,,,,,,,,,,,,SI,,,,,,,,,,,,,,,,,,,,,,,,,,,,,,3%,,,,,,,,,,,,,,,,,,,,,,,,,,,,,,,,,,,,,,,,,,,,,,,,,,,,,,,,,,,,,,,,,,,,,,,,,,,,,,,,,,,,,,,,,,,,,,,,,,,,,,,,
GUAMUCHIL LA I NOTICIAS PARA MI,CCPRI/3/TC/13/19979,Diario,Guamuchil La I Noticias Para Mi,"Empresas El Debate, S.A.de C.V.",EDE000301QT5,Sinaloa,555,81400,Salvador Alvarado,Centro,Silverio Trueba y 22 de Dic.,673.732.5150 ,Luis Javier Salido Artola,María Andrea Miranda Ramos,Vianey Contreras,,22 MAR 2022, www.debate.com.mx,mary.avendano@debate.com.mx,Shamalak Edison Ibarra Valdez,Shamalak Edison Ibarra Valdez,Oralia Rendón Gaxiola,SI,NO,SI,SI,Periódico,GUAMUCHIL LA I NOTICIAS PARA MI,CCPRI/3/TC/13/19979,Diario,02 MAY 2022,15 MAR 2022,2924,Certificadora,Agencia Certificadora y Gestora de Medios SC,88,2853,182072,6248,251064,2853,GUAMUCHIL LA I NOTICIAS PARA MI,CCPRI/3/TC/13/19979,Diario,"Agencia Certificadora y Gestora de Medios, S.C.",Ciudad De México,49,1402-14,6500,Cuauhtemoc,Cuauhtémoc,Río Mississipi,55.3685.2022,www.agenciacgm.com,Cuestionario,2853,273,95,08 MAR 2022,15 MAR 2022,Internet,Más Menos Cinco,48%,52%,87%,9%,19%,27%,21%,22%,31%,21%,16%,,24%,27%,29%,,9%,1%,,,,,,MORAL,acgm.sc@gmail.com,11%,10%,26%,,26%,16%,,,,,,,,,,75240,,,,,13%,3%,5%,,,,,,,,,,,,,,,,,,,,4%,,,,,,,,,,,,,,,,,,,,,,,,,,,,,,,,,,,,,,,,,,,,,,,,,,,,,,,,,,,,,,,,,,,,,,,,,,,,,,,,,,,,,,,,,,,,,,,28%,15%,,,,,,,,,,,,,,,,,,,,
GUASAVE LA I NOTICIAS PARA MI,CCPRI/3/TC/13/19981,Diario,Guasave La I Noticias Para Mi,"El Debate, S.A. de C.V.",DEB800830RU6,Sinaloa,52,81000,Guasave,Centro,Av. Cuauhtémoc,687 872 3200 ,Ildefonso Salido Ibarra,Andrea Miranda,Edgar Vega,08 JUL 2010,23 ABR 2022, www.debate.com.mx,debate@debate.com.mx,Edison Ibarra,Anabel de la Rocha,María de los Ángeles Avendaño,SI,SI,SI,SI,Periódico,GUASAVE LA I NOTICIAS PARA MI,CCPRI/3/TC/13/19981,Diario,02 MAY 2022,17 MAR 2022,3038,Certificadora,Agencia Certificadora y Gestora de Medios SC,88,2986,188584,4576,262768,2986,GUASAVE LA I NOTICIAS PARA MI,CCPRI/3/TC/13/19981,Diario,"Agencia Certificadora y Gestora de Medios, S.C.",Ciudad De México,49,1402-14,6500,Cuauhtemoc,Cuauhtémoc,Río Mississipi,55.3685.2022,www.agenciacgm.com,Cuestionario,2986,284,95,10 MAR 2022,17 MAR 2022,Internet,Más Menos Cinco,47%,53%,94%,13%,34%,19%,12%,23%,47%,17%,19%,42%,,15%,22%,,9%,2%,,,,,SI,MORAL,acgm.sc@gmail.com,7%,5%,13%,25%,33%,13%,,,11%,,,,,,,78760,,,,,6%,10%,7%,Ote,SI,,,,,,,,,,,,,,,,,,2%,,,,,,,,,,,,,,,,,,,,,,,,,,,,,,,,,,,,,,,,,,,,,,,,,,,,,,,,,,,,,,,,,,,,,,,,,,,,,,,,,,,,,,,,,,,,,,,,,,,,,,,,,,,,,,,,,,,,
LA SIRENA CULIACAN,CCPRI/3/TC/13/19743,Diario,La Sirena Culiacan,"Empresas El Debate, S.A. de C.V.",EDE000301QT5,Sinaloa,555,80000,Culiacán,Centro,Francisco I Madero,667.759.0900 ,Luis Javier Salido Artola,María Andrea Miranda Ramos,Gustavo Lizarraga Reyes,,12 DIC 2018, www.debate.com.mx,mary.avendano@debate.com.mx,Edison Shamalak Ibarra Valdéz,Edison Shamalak Ibarra Valdéz,María de los Ángeles Avendaño Gálvez,SI,NO,SI,SI,Periódico,LA SIRENA CULIACAN,CCPRI/3/TC/13/19743,Diario,17 ENE 2019,12 DIC 2018,30000,Certificadora,"Agencia Certificadora y Gestora de Medios, S.C.",91,29849,2730000,13741,2716259,29849,LA SIRENA CULIACAN,CCPRI/3/TC/13/19743,Diario,"Agencia Certificadora y Gestora de Medios, S.C.",Ciudad De México,49,1402-14,6500,Cuauhtemoc,Cuauhtémoc,Río Mississipi,55.3685.2022,http://www.agenciacgm.com,Cuestionario,29849,930,96,05 DIC 2018,12 DIC 2018,Internet,Más Menos Cuatro,58%,42%,5%,26%,31%,14%,14%,14%,40%,21%,27%,,28%,19%,24%,,,,,,,Edison Shamalak Ibarra Valdez,,MORAL,acgm.sc@gmail.com,4%,2%,25%,21%,24%,13%,,,8%,,,,,,,,,,,,95%,9%,6%,,,,,,,,,,,,,,,,,,,8%,2%,,,,,,,,,,,,,,,,,,,,,,,,,,,,,,,,,,,,,,,,,,,,,,,,,,,,,,,,,,,,,,,,,,,,,,,,,,,,,,,,,,,,,,,,,,,,,,,,,20%,,,,,,,,,,,,,,,,,,,
