PRAXIS DE LA REGENERACIÓN POLÍTICA,CCPRI/3/TC/15/20470,Quincenal,Praxis De La Regeneración Política,Claudia Reyes González,REGC7309122W2,México,9,54000,Tlalnepantla De Baz,Centro,Cerrada Vasconcelos,55.6655.0692 ,Claudia Reyes González,Claudia Reyes González,Gabrielle Morales Reyes,15 OCT 2003,30 JUN 2019, praxispolitica.com.mx,primeropraxis@gmail.com,Claudia Reyes González,Claudia Reyes González,Claudia Reyes González,SI,NO,SI,SI,Periódico,PRAXIS DE LA REGENERACIÓN POLÍTICA,CCPRI/3/TC/15/20470,Quincenal,30 JUL 2019,11 JUL 2019,5000,Certificadora,"Asociación Interactiva Para el Desarrollo Productivo, A. C.",8,5000,,,,,PRAXIS DE LA REGENERACIÓN POLÍTICA,CCPRI/3/TC/15/20470,Quincenal,Asociación Interactiva para el Desarrollo Productivo A.C.,México,4,Lt. 8,,Ecatepec,Quinto Sol,Avenida Ensueño,,http://www.aindep.org/,Cuestionario,1203,500,95,01 FEB 2019,31 MAY 2019,Telefónica,Más Menos Cinco,22%,78%,85%,17%,32%,27%,9%,35%,40%,15%,18%,9%,45%,10%,15%,,,,,,,Claudia Reyes González,,MORAL,informacion@aindep.org.mx,,5%,10%,,,,,,,800,800,100,,,,,,,,,15%,9%,,1,,,,,,,,,,,1%,,,,,,30%,10%,3%,25%,35%,,,,,39200,39200,4900,,,,,,,,,,,,,,,,,,,,,,,,,,,,,,,,,,,,,,,,,,,,,,,,,,,,,,,,,,,,,,,,,,,,,,,,,,,,,,,,,,,,,,,,,,,,,,,,,,,,,,,,,,,
PUNTUAL PERIODISMO DE TESIS,1/432-02-15952,Diario,Puntual Periodismo De Tesis,Impresos Puntual Sociedad de Responsabilidad Limitada de C.V.,IPU160301BT9,México,1218,50070,Toluca,Reforma y Ferrocarriles Nales.,Primero de Mayo,5373 3185 ,Antonio Huerta Gutiérrez,José Contreras Contreras,Bonifacio Quezada Mejia,27 MAY 1997,22 JUL 2019, www.diariopuntual.com.mx,diariopuntual@hotmail.com,Antonio Huerta Gutiérrez,Antonio Huerta Gutiérrez,Enrique Castañeda Guerrero,SI,NO,SI,SI,Periódico,PUNTUAL PERIODISMO DE TESIS,1/432-02-15952,Diario,19 AGO 2019,24 JUL 2019,64000,Certificadora,"Asociación Interactiva Para el Desarrollo Productivo, A. C.",90,64000,,,,,PUNTUAL PERIODISMO DE TESIS,1/432-02-15952,Diario,Asociación Interactiva para el Desarrollo Productivo A.C.,México,4,Lt. 8,,Ecatepec,Quinto Sol,Avenida Ensueño,,http://www.aindep.org/,Cuestionario,1203,500,95,01 ABR 2019,01 JUL 2019,Internet,Más Menos Cinco,25%,75%,90%,17%,28%,24%,13%,40%,35%,12%,22%,13%,35%,11%,15%,,,,,,,,,MORAL,informacion@aindep.org.mx,,5%,13%,,15%,,,,40%,,,,,,722.167.2086 ,,,,,,10%,12%,,,,,,,,,5754000,5760000,64000,,1%,,,,,,,10%,4%,,35%,,,,,,,,,,,,,,,,,,,,,,,,,,,,,,,,,,,,,,,,,,,,,,,,,,,,,,,,,,,,,,,,,,,,,,,,6000,,,,,,,,,,,,,,,,,,,,,,,,,,,,,,,,,,,,,,,,,,
RESEÑA PERIODISTICA,1/432-91-07605,Mensual,Reseña Periodistica,Heriberto López Noriega,LONH660216Q36,México,207,3600,Tenancingo,Centro,Guerrero Ote,714 142 0072 ,,,,25 FEB 1984,15 AGO 2019, www.resenaperiodistica.com,resena4@hotmail.com,Sergio López Velázquez,Heriberto López Noriega,Sergio Alberto López Noriega,SI,NO,SI,SI,Periódico,RESEÑA PERIODISTICA,1/432-91-07605,Mensual,30 SEP 2019,23 SEP 2019,10000,Certificadora,"Jimsa Comunicación, Activación de Marcas, S.A. de C.V.",3,10000,,,,,RESEÑA PERIODISTICA,1/432-91-07605,Mensual,"Jimsa Comunicación, Activación de Marcas, S.A. de C.V.",Ciudad De México,58,1,6720,Cuauhtemoc,Doctores,Dr. Jiménez,55448561,,Cuestionario,550,150,97,04 AGO 2019,08 SEP 2019,Internet,Más Menos Tres,27%,73%,70%,,37%,41%,22%,,100%,,56%,4%,40%,,,,,,,,,,,MORAL,jimsacomunicacion@hotmail.com,,,,23%,,,,,,25800,25800,8600,,,,,,22%,,,30%,,,Bis,,,,,,,1200,1200,400,,,,,,,,,,,,,,,,,3000,3000,1000,,,,,,,,,13%,17%,,,,,,,,,,,,,,,25%,,,,,,,,,,,,,,,,,,,,,,,,,,,,,,,,,,,,,,,,,,,,,,,,,,,,,,,,,,,,,,,,,,,,,,,,,,,,,,,,,,
SEMANARIO LA OPINIÓN PROYECCIÓN POLÍTICA DEL ESTADO DE MÉXICO,CCPRI/3/TC/14/20096,Semanal,Semanario La Opinión Proyección Política Del Estado De México,María Concepción Sánchez García,SAGC850926PQ8,México,101,50170,Toluca,Seminario 1a Sección,Gustavo G. Velázquez,722.217.9633 ,Margarito Sánchez Mendoza,Rosalinda García Mendoza,Rosalinda García Mendoza,07 MAR 1989,, www.semanariolaopinion.com,semanario_laopinion@hotmail.com,Rosalinda García Mendoza,,María Concepción Sánchez García,NO,NO,SI,SI,Periódico,SEMANARIO LA OPINIÓN PROYECCIÓN POLÍTICA DEL ESTADO DE MÉXICO,CCPRI/3/TC/14/20096,Semanal,21 DIC 2021,17 DIC 2021,15000,Certificadora,"Romay Hermida y Cía, S. C.",12,14888.33,,,,,SEMANARIO LA OPINIÓN PROYECCIÓN POLÍTICA DEL ESTADO DE MÉXICO,CCPRI/3/TC/14/20096,Semanal,"Romay Hermida y Cía, S. C.",Puebla,73,,72810,San Andres Cholula,Paseos de Cholula,Paseo de Cholula,012222218809,,Cuestionario,14800,500,95,01 NOV 2021,30 NOV 2021,Calle,Más Menos Cinco,28%,72%,100%,4%,28%,41%,20%,28%,57%,15%,42%,2%,35%,8%,13%,,6%,,,,,,,MORAL,romayhermidayciasc@gmail.com,,7%,,21%,52%,,,,,178660,178660,14888.33,2%,2%,,,,,17%,,,,,,,,,,,,,,,,,,,,,,,,,,,,,,,,,,,,,,,,,,,,,,,,,,,,,,,,,,,,,,,,,,,,,,,,,,,,,,,,,,,,,,,,,,,,,,,,,,,,,,,,,,,,,,,,,,,,,,,,,,,,,,,,,,,,,,,,,,,,
SEMANARIO MI CORRESPONSAL,CCPRI/3/TC/10/18928,Semanal,Semanario Mi Corresponsal,"Semanario Mi Corresponsal, S.A. de C.V.",SCO0501131Y6,México,222,55120,Ecatepec,Ciudad Azteca,Toltecas,1086.6717 ,Gabriel Rodríguez Vázquez,,,09 ENE 2005,10 JUN 2019, www.semanariomicorresponsal.com.mx,micorresponsal@yahoo.com.mx,Gabriel Rodríguez Vázquez,Gabriel Rodríguez Vázquez,,SI,NO,SI,SI,Periódico,SEMANARIO MI CORRESPONSAL,CCPRI/3/TC/10/18928,Semanal,27 JUN 2019,12 JUN 2019,6000,Certificadora,"Asociación Interactiva Para el Desarrollo Productivo, A. C.",15,6000,,,,,SEMANARIO MI CORRESPONSAL,CCPRI/3/TC/10/18928,Semanal,Asociación Interactiva para el Desarrollo Productivo A.C.,México,4,Lt. 8,,Ecatepec,Quinto Sol,Avenida Ensueño,,http://www.aindep.org/,Cuestionario,1203,500,95,01 ABR 2019,12 JUN 2019,Internet,Más Menos Cinco,35%,65%,80%,16%,20%,28%,25%,45%,20%,15%,15%,10%,35%,16%,20%,,,,,,,,,MORAL,informacion@aindep.org.mx,,5%,20%,,30%,,,,15%,89200,89200,5946.67,,,,,,,,,20%,6%,,Lt. 30,,,,,,,,,,,,,,,,,,10%,4%,,45%,,,,,800,800,53.33,,,,,,,,,,,,,,,,,,,,,,,,,,,,,,,,,,,,,,,,,,,,,,,,,,,,,,,,,,,,,,,,,,,,,,,,,,,,,,,,,,,,,,,,,,,,,,,,,,,,,,,,,,,
THE MEXICO POST,CCPRI/3/TC/20/21296,Diario,The Mexico Post,"Newspaper&Television, S.A. de C.V.",NEW151127BR0,Ciudad De México,400,1219,Cuajimalpa,Lomas de Santa Fe,Mario Pani,55.8541.6063 ,Javier García Beltrán Camacho,,Santos Sánchez Albarrán,11 OCT 2019,29 ENE 2020, www.themexicopost.com,themxpost@gmail.com,Alejandro Franco Mendieta,Javier García Beltrán Camacho,Chistian García Beltrán Camacho,SI,NO,SI,SI,Periódico,THE MEXICO POST,CCPRI/3/TC/20/21296,Diario,17 MAR 2020,17 FEB 2020,68293,Certificadora,"Aplicaciones Editoriales, S.A. de C.V.",89,66110,,,,,THE MEXICO POST,CCPRI/3/TC/20/21296,Diario,"Aplicaciones Editoriales, S.A. de C.V.",San Luis Potosí,760,,78200,San Luis Potosi,Del Valle,Agustín Vera,444.811.3002,,Encuesta,630,600,97,06 FEB 2020,10 FEB 2020,Internet,Más Menos Tres,13%,87%,100%,22%,24%,30%,17%,89%,11%,,46%,7%,33%,,14%,15%,4%,,,,,,,,mateo_press@yahoo.com.mx,4%,3%,,30%,23%,,,,28%,5883790,5883790,66110,,,,,,,,,,,,,,,,,,,,,,,,,,,,,,,,,,,,,,,,,,,,,,,,,,,,,,,,,,,,,,,,,,,,,,,,,,,,,,,,,,,,,,,,,,,,,,,,,,,,,,,,,,,,,,,,,,,,,,,,,,,,,,,,,,,,,,,,,,,,,,,,,,,
VOCERO DE UN NUEVO DÍA,CCPRI/3/TC/19/21244,Semanal,Vocero De Un Nuevo Día,BENITO ROSALES,,México,10,54400,Nicolas Romero,,FRANCISCO VILLA,55.7852.8828 ,JUAN YESCAS,ARMANDO CAMACHO,ALICIA ROSALES GARCÍA,01 ENE 2010,,,benito.vocero@hotmail.com,BENITO ROSALES,BENITO ROSALES,BENITO ROSALES,NO,NO,SI,SI,Periódico,VOCERO DE UN NUEVO DÍA,CCPRI/3/TC/19/21244,Semanal,09 SEP 2020,06 SEP 2020,8000,Certificadora,"Asociación Interactiva Para el Desarrollo Productivo, A. C.",15,7200,44064,864,43200,2880,VOCERO DE UN NUEVO DÍA,CCPRI/3/TC/19/21244,Semanal,Asociación Interactiva para el Desarrollo Productivo A.C.,México,4,Lt. 8,,Ecatepec,Quinto Sol,Avenida Ensueño,,http://www.aindep.org/,Encuesta,1203,500,95,04 MAY 2020,04 JUL 2020,Telefónica,Más Menos Cinco,41%,59%,98%,11%,28%,32%,15%,32%,34%,,50%,11%,23%,5%,9%,,,,,,,,,MORAL,informacion@aindep.org.mx,,10%,34%,,,,,,,64800,64800,4320,,,,,,,,,2%,4%,,,,,,,,,,,,,,,,,,,,,2%,,,,,,,,,,,,,,,,,,,,,,,,,,,,,,,,,,,,,,,,,,2%,,,,,,,,,,,,,,,,,,,,,,,,,,,,,,,,,37%,33%,28%,,,,,,,,,,,,,,,,,,,,,,,,,,,,,,,,,,,,,,,
8 COLUMNAS,CCPRI/3/TC/22/21363,Lunes A Sábado,8 Columnas,"EDITORIAL SIXBRO, S.A. DE C.V.",ESI010508UJ4,México,700,50080,Toluca,San Bernardino,Plutarco González,722.215.4934 ,Simón Yamin Faure,Simón Yamin Faure,,02 MAY 1975,15 FEB 2022, www.8columnas.com.mx,8columnas@8columnas.com.mx,,José Guadalupe Leyva Turrubiates,Emilio Yamin Faure,SI,SI,SI,SI,Periódico,8 COLUMNAS,CCPRI/3/TC/22/21363,Lunes A Sábado,10 MAY 2022,17 FEB 2022,15000,Certificadora,"Brumat Media, S.A. de C.V.",84,14830,1134000,14280,1119720,13330,8 COLUMNAS,CCPRI/3/TC/22/21363,Lunes A Sábado,"Brumat Media, S.A. de C.V.",,,,,,,,,,Cuestionario,14830,375,95,09 FEB 2022,16 FEB 2022,Internet,Más Menos Cinco,38%,62%,84%,14%,26%,32%,21%,43%,26%,21%,33%,6%,48%,,13%,,8%,,,,,,,,,,7%,10%,,19%,11%,,,20%,126000,126000,1500,,,722.213.1255 ,,,,,,16%,,24%,,,,,,,,,,,,,,,,,14%,,4%,,,,,,,,,,,,,,,,,,,,,,,,,,,,,,,,,,,,,,,,,,,,,,,,,,,,,,,,,,,,,,,,,,,,,,,,,,,,,,,,,,,,,,,,,,,,,,,,,,,,,,,,,,,,,,,,,,,,,
DIARIO ABC DE MICHOACAN,CCPRI/3/TC/10/18745,Diario,Diario Abc De Michoacán,"Casa Editorial ABC de Michoacán, S. A. de C. V.",CEA060922657,Michoacán,1563,60110,Uruapan,Fracc. Lomas del Valle Norte,Carretera a Pátzuaro,452.527.2230 ,Pedro Andrade González,,Guillermo Cerda León,12 SEP 2001,, diarioabcdemichoacan.com.mx/lasnoticias/,abcmichpublicidad@yahoo.com.mx,Pedro Andrade González,Pedro Andrade González,Edgar César Andrade Bolaños,NO,SI,SI,SI,Periódico,DIARIO ABC DE MICHOACAN,CCPRI/3/TC/10/18745,Diario,12 OCT 2021,14 SEP 2021,18659,Certificadora,"Aplicaciones Editoriales, S.A. de C.V.",92,17350.66,1496208,60211,1563693,16996.66,DIARIO ABC DE MICHOACAN,CCPRI/3/TC/10/18745,Diario,"Informática & Marketing, S.A. de C.V.",,,,,,,,,,Entrevista,630,600,97,03 SEP 2021,10 SEP 2021,,Más Menos Tres,29%,71%,100%,,6%,39%,33%,97%,3%,,37%,12%,46%,,5%,13%,11%,,,,,,,,mateo_press@yahoo.com.mx,18%,4%,,34%,15%,,,,23%,32568,32568,354,,,,127696,,,,,,,,,,,,,,,,,,,,,,,,,,,,,,,,,,,,,,,4%,,,,,,,,,,,,,,,,,,,,,,,,,,,,,,,,,,,,,,,,,,,,,,,,,,,,,,,,,,,,,,,,,,,,,,,,,,,,,,,,,,,,,,,,,,,,,,,,,,,,,,,,
EL SOL DE MORELIA,CCPRI/3/TC/09/18468,Diario,El Sol De Morelia,"Cía. Periodística del Sol de Michoacán, S.A. de C.V.",CPS1007063X0,Michoacán,783,58000,Morelia,Centro,Av. Madero Oriente,01.443.312.7773 ,Paquita Ramos de Vázquez,Marcos Knapp García,Maria Carmen Castillo Escalona,10 AGO 1978,10 SEP 2019, www.oem.com.mx,dirmor@oem.com.mx,Paquita Ramos de Vázquez,Carlos Salvador Huerta Lara,Nubia Victoria Gonzalez Quiroz,SI,NO,SI,SI,Periódico,EL SOL DE MORELIA,CCPRI/3/TC/09/18468,Diario,11 MAR 2019,28 FEB 2019,8998,Certificadora,Agencia Certificadora y Gestora de Medios SC,88,8998,791824,,791824,8998,EL SOL DE MORELIA,CCPRI/3/TC/09/18468,Diario,"Agencia Certificadora y Gestora de Medios, S.C.",Ciudad De México,49,1402-14,6500,Cuauhtemoc,Cuauhtémoc,Río Mississipi,55.3685.2022,www.agenciacgm.com,Cuestionario,8998,450,95,28 FEB 2019,07 MAR 2019,,Más Menos Cinco,47%,53%,100%,6%,25%,39%,23%,30%,18%,33%,48%,6%,40%,,6%,13%,5%,,,,,,,MORAL,acgm.sc@gmail.com,7%,,19%,28%,19%,,,,34%,,,,,,,,,,,,,,,,,,,,,,,,,,,,,,,,,,,,,,,,,,,,,,1%,,,,,,,,,,,,,,,,,,,,,,,,,,,,,,,,,,,,,,,,,,,,,,,,,,,,,,,,,,,,,,,,,,,,,,,,,,,,,,,,,,,,,,,,,,,,,,,,,,,,,,,,
EL SOL DE ZAMORA,CCPRI/3/TC/09/18465,Diario,El Sol De Zamora,"Cía. Periodística del Sol de Michoacán, S. A. de C. V.",CPS1007063X0,Michoacán,783,58000,Morelia,Morelia Centro,Av. Madero Oriente,01.443.312.7773 ,Paquita Ramos de Vázquez,Marcos Knapp García,María del Carmen Castillo Escalona,21 JUN 1981,13 OCT 2018, http://www.oem.com.mx,dirmor@oem.com.mx,Paquita Ramos de Vázquez,Carlos Salvador Huerta Lara,Nubia Victoria González Quiroz,SI,NO,SI,SI,Periódico,EL SOL DE ZAMORA,CCPRI/3/TC/09/18465,Diario,11 MAR 2019,07 MAR 2019,6844,Certificadora,Agencia Certificadora y Gestora de Medios SC,88,6844,602272,,602272,6844,EL SOL DE ZAMORA,CCPRI/3/TC/09/18465,Diario,Agencia Certificadora y Gestora de Medios SC,Ciudad De México,49,1402 14,6500,Cuauhtemoc,Cuauhtémoc,Río Mississipi,5536852022,www.agenciacgm.com,Cuestionario,6844,792,97,28 FEB 2019,07 MAR 2019,Internet,Más Menos Tres,47%,53%,100%,6%,25%,39%,23%,30%,18%,33%,34%,9%,38%,,19%,8%,6%,,,,,,,MORAL,acgm.sc@gmail.com,7%,,19%,32%,21%,,,,31%,,,,,,,,,,,,,,,,,,,,,,,,,,,,,,,,,,,,,,,,,,,,,,2%,,,,,,,,,,,,,,,,,,,,,,,,,,,,,,,,,,,,,,,,,,,,,,,,,,,,,,,,,,,,,,,,,,,,,,,,,,,,,,,,,,,,,,,,,,,,,,,,,,,,,,,,
LA VOZ DE MICHOACAN,1/432-87-05151,Diario,La Voz De Michoacan,"La Voz de Michoacán, S.A. de C.V.",VMI600516JG7,Michoacán,1270,58190,Morelia,Agustín Arriaga Rivera,Periodismo José Tocavén Lavin,443.322.5600 ,Graciela González Villanueva,Álvaro E. Medina González,Jorge Manzo Méndez,19 JUN 1948,15 FEB 2022, www.lavozdemichoacan.com.mx,egutierrez@vozdemichoacan.com.mx,Álvaro Esteban Medina González,María Graciela Medina González,Araceli Vega,SI,SI,SI,SI,Periódico,LA VOZ DE MICHOACAN,1/432-87-05151,Diario,17 MAY 2022,25 FEB 2022,47838,Certificadora,"Brumat Media, S.A. de C.V.",103,46851,3899065,101661,4825653,46851,LA VOZ DE MICHOACAN,1/432-87-05151,Diario,"Brumat Media, S.A. de C.V.",,,,,,,,,,Entrevista,46851,382,95,16 FEB 2022,23 FEB 2022,Internet,Más Menos Cinco,45%,55%,70%,12%,27%,29%,32%,62%,33%,5%,45%,18%,27%,,10%,,7%,,,,,,,,,,,,,17%,8%,,,31%,,,,,,,1028249,,,,,30%,,22%,,,,,,,,,,,,,,,,,10%,,5%,,,,,,,,,,,,,,,,,,,,,,,,,,,,,,,,,,,,,,,,,,,,,,,,,,,,,,,,,,,,,,,,,,,,,,,,,,,,,,,,,,,,,,,,,,,,,,,,,,,,,,,,,,,,,,,,,,,,,
PUBLIMETRO MICHOACÁN,CCPRI/3/TC/19/21264,Lunes A Viernes,Publimetro Michoacán,"Centro Internacional de Comercio y Publicidad, S.A. de C.V.",CIC8910304B1,Michoacán,470,58290,Morelia,Bosques Camelinas,Dr. Ignacio Chávez Gálvez,443.315.6276 ,Eduardo Luis Laris Rodríguez,José Lebeña Acevo,Erick Zaragoza Álvarez,26 JUN 2017,, www.publimetro.com.mx,jaime.amezcua@publimetro.com.mx,Juan Carlos de Guerrero Osio Laris,Juan Carlos de Guerrero Osio Laris,Jaime Amezcua Contreras,NO,NO,SI,SI,Periódico,PUBLIMETRO MICHOACÁN,CCPRI/3/TC/19/21264,Lunes A Viernes,08 ABR 2021,05 ABR 2021,34015,Certificadora,Agencia Certificadora y Gestora de Medios SC,63,34000,,,,,PUBLIMETRO MICHOACÁN,CCPRI/3/TC/19/21264,Lunes A Viernes,Agencia Certificadora y Gestora de Medios SC,Ciudad De México,49,1402 14,6500,Cuauhtemoc,Cuauhtémoc,Río Mississipi,5536852022,www.agenciacgm.com,Cuestionario,34000,439,96,30 MAR 2021,06 ABR 2021,Calle,Más Menos Cuatro,44%,56%,91%,22%,31%,26%,15%,48%,21%,15%,64%,19%,10%,,7%,,7%,,,,,,,MORAL,acgm.sc@gmail.com,6%,,16%,,30%,7%,13%,,20%,2077740,2077740,32980,,,,,,,,,9%,,11%,,,,,,,,64260,64260,1020,,,,,,,12%,,,,,,,,,,,,,,,,,,,,,,,,,,,,,,,,,,,,,,,,,,,,,,,,,,,,,,,,,,,,,,,,,,,,,,,,,,,,,,,,,,,,,,,,,,,,,,,,,,,,,,,,,,,,,,,,,,,,,,,
"DIARIO DE MORELOS, AL SERVICIO DE LA COMUNIDAD",1/432-78-00486,Diario,"Diario De Morelos, Al Servicio De La Comunidad","Editoriales de Morelos, S.A. de C.V.",EMO950208EQ6,Morelos,132,62050,Cuernavaca,Las Palmas Sur,Av. Morelos Sur,777.362.0220 ,Miguel Ángel Bracamontes Baz,Jorge López Flores,Trinidad Victorino Zurita,19 ABR 1978,21 FEB 2022, www.diariodemorelos.com,oyuki@diariodemorelos.com,Consuelo Oyuki Zapata Torres,Consuelo Oyuki Zapata Torres,Jorge López Flores,SI,SI,SI,SI,Periódico,"DIARIO DE MORELOS, AL SERVICIO DE LA COMUNIDAD",1/432-78-00486,Diario,09 MAR 2022,04 MAR 2022,41000,Certificadora,Agencia Certificadora y Gestora de Medios SC,89,37800,2328240,284800,3022440,33960,"DIARIO DE MORELOS, AL SERVICIO DE LA COMUNIDAD",1/432-78-00486,Diario,"Agencia Certificadora y Gestora de Medios, S.C.",Ciudad De México,49,1402-14,6500,Cuauhtemoc,Cuauhtémoc,Río Mississipi,55.3685.2022,www.agenciacgm.com,Cuestionario,37800,438,95,24 FEB 2022,04 MAR 2022,Internet,Más Menos Cinco,48%,52%,94%,18%,25%,38%,19%,100%,,,48%,23%,29%,,,,11%,,,,,,,MORAL,acgm.sc@gmail.com,,,,,,15%,,,,,,,5%,,,979000,,,10%,18%,6%,,,,,,,,,,,,,,,,,,,,,,,,,,,,,341760,341760,3840,,,,,,,,,,,,,,,,,,,,,,,,,,,,,,,,,,,,,,,,,,,,,,,,,,,,,,,,,,,,,,,,,,,,,41%,,,,,,,,,,,,,,,,,,,,,,,,,,,,,,,,,,,,,,
EL GRÁFICO MORELOS EL PRIMER DIARIO DE LA MAÑANA,CCPRI/3/TC/18/21055,Diario,El Gráfico Morelos El Primer Diario De La Mañana,"El Universal Compañía Periodística Nacional, S.A. de C.V.",UPN830920KC4,Morelos,4,62000,Cuernavaca,Centro,Hermenegildo Galeana,777.310.1604 ,Juan Francisco Ealy Ortiz,Edgar Córdova Rodríguez,Javier Rubio,12 JUN 2018,, www.eluniversal.com.mx,contacto@eluniversal.com.mx,Juan Francisco Ealy Lanz Duret,Ildefonso Fernández Guevara,Juan Manuel Ramírez Rubio,NO,SI,SI,SI,Periódico,EL GRÁFICO MORELOS EL PRIMER DIARIO DE LA MAÑANA,CCPRI/3/TC/18/21055,Diario,08 ABR 2021,11 MAR 2021,17197,Certificadora,Agencia Certificadora y Gestora de Medios SC,88,16811,1513336,33968,1479368,16811,EL GRÁFICO MORELOS EL PRIMER DIARIO DE LA MAÑANA,CCPRI/3/TC/18/21055,Diario,"Agencia Certificadora y Gestora de Medios, S.C.",Ciudad De México,49,1402-14,6500,Cuauhtemoc,Cuauhtémoc,Río Mississipi,55.3685.2022,www.agenciacgm.com,Cuestionario,16811,459,95,04 MAR 2021,11 MAR 2021,Calle,Más Menos Cinco,35%,65%,100%,20%,28%,22%,17%,14%,21%,35%,11%,,30%,33%,23%,,,,,,,,,MORAL,acgm.sc@gmail.com,,,30%,,49%,,,,,,,,,,,,,,,,,13%,,Desp. 108,,,,,,,,,,,,,,,,,,,3%,,,,,,,,,,,,,,,,,,,,,,,,,,,,,,,,,,,,7%,11%,30%,3%,,,,,,,,,,,,,,,,,,,,,,,,,,,,,,,,,,,,,,,,,,,,,,,,,,,,,,,,,,,,,,,,,,,,,,,,,,,,,
EL SOL DE CUAUTLA,CCPRI/3/TC/09/18418,Diario,El Sol De Cuautla,"Cía. Periodística del Sol de Morelos, S. A. de C. V.",CPS100706CD4,Morelos,5,62740,Cuautla,Centro,Fin del Rul,777.314.2122 ,Paquita Ramos de Vázquez,Daniel Martínez Castellanos,Katy Mariana Cárdenas Espino,08 NOV 1978,, www.elsoldecuautla.com.mx,josegurza@elsoldecuernavaca.com.mx,Daniel Martínez Castellanos,Carlos Salvador Huerta Lara,Elizabeth Correa Ávila,NO,NO,SI,SI,Periódico,EL SOL DE CUAUTLA,CCPRI/3/TC/09/18418,Diario,26 ABR 2021,29 DIC 2020,5173,Certificadora,Agencia Certificadora y Gestora de Medios SC,91,5072,470743,9191,461552,5072,EL SOL DE CUAUTLA,CCPRI/3/TC/09/18418,Diario,"Agencia Certificadora y Gestora de Medios, S.C.",Ciudad De México,49,1402-14,6500,Cuauhtemoc,Cuauhtémoc,Río Mississipi,55.3685.2022,www.agenciacgm.com,Encuesta,5072,412,96,15 OCT 2020,29 DIC 2020,Internet,Más Menos Cuatro,34%,66%,88%,11%,27%,33%,21%,43%,22%,24%,43%,15%,30%,,12%,,12%,,,,,,,MORAL,acgm.sc@gmail.com,8%,,11%,14%,14%,11%,,,22%,,,,,,,,,,,,12%,,16%,,,,,,,,,,,,,,,,,11%,,,,,,,,,,,,,,,,,,,,,,,,,,,,,,,,,,,,,,,,,,,,,,,,,,,,,,,,,,,,,,,,,,,,,,,,,,,,,,,,,,,,,,,,,,,,,,,,,,,,,,,,,,,,,,,,,,,,,,,
EL SOL DE CUERNAVACA,CCPRI/3/TC/09/18420,Diario,El Sol De Cuernavaca,"Cía. Periodística del Sol de Morelos, S. A. de C. V.",CPS100706CD4,Morelos,125,62050,Cuernavaca,Las Palmas,Galeana,777.314.2122 ,Paquita Ramos de Vázquez,Daniel Martínez Castellanos,Katy Mariana Cárdenas Espino,27 ABR 1978,, http://www.elsoldecuernavaca.com.mx,josegurza@elsoldecuernavaca.com.mx,Daniel Martínez Castellanos,Carlos Salvador Huerta Lara,Elizabeth Correa Ávila,SI,NO,SI,SI,Periódico,EL SOL DE CUERNAVACA,CCPRI/3/TC/09/18420,Diario,27 ABR 2021,01 DIC 2020,4858,Certificadora,Agencia Certificadora y Gestora de Medios SC,91,4763,442078,8645,433433,4763,EL SOL DE CUERNAVACA,CCPRI/3/TC/09/18420,Diario,Agencia Certificadora y Gestora de Medios SC,Ciudad De México,49,1402 14,6500,Cuauhtemoc,Cuauhtémoc,Río Mississipi,5536852022,www.agenciacgm.com,Cuestionario,4763,416,97,28 JUL 2020,01 DIC 2020,,Más Menos Tres,39%,61%,91%,5%,17%,33%,26%,66%,11%,8%,61%,7%,26%,,6%,,8%,,,,,,,MORAL,acgm.sc@gmail.com,11%,8%,15%,22%,8%,5%,,10%,27%,,,,,,,,,,,,9%,,15%,,,,,,,,,,,,,,,,,,,,,,,,,,,,,,,,5%,,,,,,,,,,,,,,,,,,,,,,,,,,,,,,,,,,,,,,,,,,,,,,,,,,,,,,,,,,,,,,,,,,,,,,,,,,,,,,,,,,,,,,,,,,,,,,,,,,,,,,,,
EL TXORO MATUTINO,CCPRI/3/TC/19/21238,Lunes A Viernes,El Txoro Matutino,"COMERCIALIZADORA PUBLICITARIA DE CUERNAVACA, S.A. DE C.V.",CPC0701177AA,Morelos,116,62270,Cuernavaca,Lomas de la Selva,Pericón,777.311.6050 ,Juan José Arrese García,Viridiana Arias Ramirez,Rodrigo Zamora Balderrama,06 MAY 2019,01 FEB 2022, www.eltxoromatutino.com,ana@eltxoromatutino.com,Juan José Arrese García,Juan José Arrese García,Ana Lilia Marure Yde,SI,SI,SI,SI,Periódico,EL TXORO MATUTINO,CCPRI/3/TC/19/21238,Lunes A Viernes,07 MAR 2022,14 ENE 2022,4200,Certificadora,"Brumat Media, S.A. de C.V.",70,4000,,,,,EL TXORO MATUTINO,CCPRI/3/TC/19/21238,Lunes A Viernes,"Brumat Media, S.A. de C.V.",,,,,,,,,,Cuestionario,4000,351,95,07 ENE 2022,13 ENE 2022,Internet,Más Menos Cinco,31%,69%,89%,11%,28%,36%,,57%,30%,13%,53%,11%,36%,,,,10%,,,,,,,,,19%,4%,,,13%,6%,,,39%,140000,140000,2000,,,,,,,,,11%,2%,21%,Local 8,,,,,,,,,,,,,,,,4%,,7%,,,,,,,,140000,140000,2000,,,,,,,,,,,,,,,,,,,,,,,,,,,,,,,,,,,,,,,,,,,,,,,,,,,,,,,,,,,,,,,,,,,,,,,,,,,,,,,,,,,,,,,,,,,,,,,,,,,,,,,,,,,
ELREGIONALDELSUR,CCPRI/3/TC/18/21029,Lunes A Viernes,Elregionaldelsur,"Grupo Editorial Madi, S.A.S. de C.V.",GEM170725NXA,Morelos,1102,62243,Cuernavaca,Lomas de Cortes,Nueva Suecia,777.313.0507 ,,Mayra Aidee Castillo Pacheco,Gerardo Suárez Dorantes,17 JUL 2017,01 DIC 2021," www,elregional.com.mx/",regionalpubli17@gmail.com,Eolo Ernesto Pacheco Rodríguez,Mayra Aidee Castillo Pacheco,Eduardo Olvera Jacobo,SI,NO,SI,SI,Periódico,ELREGIONALDELSUR,CCPRI/3/TC/18/21029,Lunes A Viernes,04 MAR 2022,06 DIC 2021,4992,Certificadora,"Brumat Media, S.A. de C.V.",85,4872,424320,10200,414120,4872,ELREGIONALDELSUR,CCPRI/3/TC/18/21029,Lunes A Viernes,"Brumat Media, S.A. de C.V.",,,,,,,,,,Encuesta,4872,357,95,29 NOV 2021,03 DIC 2021,Internet,Más Menos Cinco,28%,72%,89%,17%,40%,22%,19%,28%,59%,13%,37%,12%,43%,,,,8%,,,,,,,,,,2%,,9%,38%,,,,24%,,,,,,,,,,,,11%,,12%,,,,,,,,,,,,,,,,,5%,,4%,8%,,,,,,,,,,,,,,,,,,,,,,,,,,,,,,,,,,,,,,,,,,,,,,,,,,,,,,,,,,,,,,,,,,,,,,,,,,,,,,,,,,,,,,,,,,,,,,,,,,,,,,,,,,,,,,,,,,,,
LA JORNADA MORELOS,CCPRI/3/TC/08/18185,Lunes A Sábado,La Jornada Morelos,"Medios Informativos Centro Sur, SA de CV",MIC180419UV6,Morelos,16,62300,Cuernavaca,Ahuatepec,Paraíso,777 424 87 58 ,,Miguel Ángel Crisanto,Dulce Maya,16 MAY 2018,30 OCT 2019, www.lajornadamorelos.com.mx,redaccionjornadamorelos@gmail.com,Mario Alberto Salgado Becil,Mario Alberto Salgado Becil,Pedro Vidal,SI,NO,SI,SI,Periódico,LA JORNADA MORELOS,CCPRI/3/TC/08/18185,Lunes A Sábado,27 NOV 2019,14 NOV 2019,5700,Certificadora,"M & A Calificación de Medios, S.C.",78,5700,444600,,444600,5700,LA JORNADA MORELOS,CCPRI/3/TC/08/18185,Lunes A Sábado,"M&A Investigación de la Comunicación, S.C.",Ciudad De México,393,301,6500,Cuauhtemoc,Cuauhtémoc,Paseo de la Reforma,5555146191,http://www.moctezumayasociados.com.mx,Cuestionario,21660,300,95,23 OCT 2019,11 NOV 2019,Internet,Más Menos Cinco,43%,57%,100%,5%,27%,30%,38%,29%,38%,33%,58%,14%,21%,,7%,6%,4%,,,,62%,,,,,,,,,,,,,,,,,,,,,,,,,,,,,,,,,,,,,,19%,,,,,,,,,,,,,,,,,,,,,,,,3%,,,,,,,,,,,,,,,,,,,,,,,,,,,,,,,,6%,,,,,,,,,,,,,,,,,,,,,,,,,,,,,,,,,,,,,,,,,,,,,,,,,,,,,,,,,,,,,,,,,,,,,
LA NOTICIA EN CALIENTE EXTRA! DE CUAUTLA,CCPRI/3/TC/10/18608,Diario,La Noticia En Caliente Extra! De Cuautla,"Editoriales de Morelos, S.A. de C.V.",EMO950208EQ6,Morelos,132,62050,Cuernavaca,Las Palmas Sur,Av. Morelos Sur,777.362.0220 ,Miguel Ángel Bracamontes Baz,Eduardo Lavín Cedillo,Israel Noriega Lagunas,18 MAY 2009,23 FEB 2022, www.extrademorelos.com,oyuki@diariodemorelos.com,Eduardo Lavín Cedillo,Consuelo Oyuki Zapata Torres,Eduardo Lavin Cedillo,SI,SI,SI,SI,Periódico,LA NOTICIA EN CALIENTE EXTRA! DE CUAUTLA,CCPRI/3/TC/10/18608,Diario,10 MAR 2022,04 MAR 2022,23291,Certificadora,Agencia Certificadora y Gestora de Medios SC,89,23060.12,1765021,20567,1744454,19600.61,LA NOTICIA EN CALIENTE EXTRA! DE CUAUTLA,CCPRI/3/TC/10/18608,Diario,"Agencia Certificadora y Gestora de Medios, S.C.",Ciudad De México,49,1402-14,6500,Cuauhtemoc,Cuauhtémoc,Río Mississipi,55.3685.2022,www.agenciacgm.com,Entrevista,23060,364,97,25 FEB 2022,04 MAR 2022,Internet,Más Menos Tres,34%,66%,91%,13%,24%,35%,28%,7%,5%,34%,17%,,30%,24%,29%,,11%,,,,,,,MORAL,acgm.sc@gmail.com,,,54%,28%,31%,14%,,,,,,,4%,,,,,,2%,10%,9%,,,,,,,,,,,,,,,,,,,,,,,,,,,,,307896,307896,3459.51,,,,,,,,,,,,,,,,,,,,,,,,,,,,,,,,,,,,,,,,,,,,,,,,,,,,,,,,,,,,,,,,,,,,,,,,,,,,,,,,,,,,,,,,,,,,,,,,,,,,,,,,,,,
LA NOTICIA EN CALIENTE EXTRA! DE MORELOS,CCPRI/3/TC/10/18610,Diario,La Noticia En Caliente Extra! De Morelos,"Editoriales de Morelos, S.A. de C.V.",EMO950208EQ6,Morelos,132,62050,Cuernavaca,Las Palmas Sur,Av. Morelos Sur,777.362.0220 ,Miguel Ángel Bracamontes Baz,Eduardo Lavín Cedillo,Israel Noriega Lagunas,18 MAY 2009,06 FEB 2022, www.extrademorelos.com,oyuki@diariodemorelos.com,Eduardo Lavín Cedillo,Consuelo Oyuki Zapata Torres,Eduardo Lavin Cedillo,SI,SI,SI,SI,Periódico,LA NOTICIA EN CALIENTE EXTRA! DE MORELOS,CCPRI/3/TC/10/18610,Diario,10 MAR 2022,04 MAR 2022,47723,Certificadora,Agencia Certificadora y Gestora de Medios SC,89,47251,3532499,42008,3490491,39219,LA NOTICIA EN CALIENTE EXTRA! DE MORELOS,CCPRI/3/TC/10/18610,Diario,"Agencia Certificadora y Gestora de Medios, S.C.",Ciudad De México,49,1402-14,6500,Cuauhtemoc,Cuauhtémoc,Río Mississipi,55.3685.2022,www.agenciacgm.com,Cuestionario,47251,419,96,25 FEB 2022,04 MAR 2022,Internet,Más Menos Cuatro,34%,66%,93%,14%,29%,33%,24%,6%,8%,32%,11%,,36%,30%,23%,,11%,,,,,,,MORAL,acgm.sc@gmail.com,,,54%,24%,31%,13%,,,,714848,714848,8032,5%,,,,,,6%,10%,7%,,,,,,,,,,,,,,,,,,,,,,,,,,,,,,,,,,,,,,,,,,,,,,,,,,,,,,,,,,,,,,,,,,,,,,,,,,,,,,,,,,,,,,,,,,,,,,,,,,,,,,,,,,,,,,,,,,,,,,,,,,,,,,,,,,,,,,,,,,
